,Unnamed: 0,id,app,reviewText,date,ratingStars
133659,153838,7c5a7beb-afc9-11e6-8fb1-c4b301cdf627,at.tomtasche.reader,Open doc reader Does what it says on the tin. Need to be ad tolerant though.,December 13 2014,4
133660,153839,7c5a7c82-afc9-11e6-8de2-c4b301cdf627,at.tomtasche.reader,awesome app Works great for me,December 13 2014,5
133661,153840,7c5a7d05-afc9-11e6-b727-c4b301cdf627,at.tomtasche.reader,Waoh Recommendable:-),December 13 2014,5
133662,153841,7c5a7d7a-afc9-11e6-bd75-c4b301cdf627,at.tomtasche.reader,Superb! Helps me keep my records up to date all the time!!,December 13 2014,5
133663,153842,7c5a7dfd-afc9-11e6-a207-c4b301cdf627,at.tomtasche.reader,"Pretty rad Does everything it needs to do to function as an ODT reader. The only thing I wish it didn't do was show all the """"""""""""""""""""""""""""""""how to"""""""""""""""""""""""""""""""" stuff upon opening it  every time you run the app. Solid program  though.""""",December 12 2014,4
133664,153843,7c5a7e75-afc9-11e6-bbbd-c4b301cdf627,at.tomtasche.reader,good ap Opened my odt files just fine. My S3Wouldnt automatically configure it and i had to manually find the file within the app. And there was no rename option but 8/10 satisfied.,December 11 2014,4
133665,153844,7c5a7ef8-afc9-11e6-a7ea-c4b301cdf627,at.tomtasche.reader,Useful Very handy for viewing  math formula doesn't work but still great app.,December 11 2014,5
133666,153845,7c5a7f70-afc9-11e6-b5b8-c4b301cdf627,at.tomtasche.reader,Good Good app ods,December 10 2014,5
133667,153847,7c5a806b-afc9-11e6-a7d0-c4b301cdf627,at.tomtasche.reader,Android open office much better for excel files,December 08 2014,2
133668,153848,7c5a80eb-afc9-11e6-a4a2-c4b301cdf627,at.tomtasche.reader,Save doesn't work and toolbar disappears I can open from USB or SD and edit but the save. Only saves the original docum ent not the edits. Also sometimes the save toolbar disappears and the original toolbar returns while editing leaving no way to save edits( though exits aren't saved) cannot use because it won't save edits and even if it did too dangerous that save toolbar disappears while exiting sometimes!,December 08 2014,1
133669,153850,7c5a81e6-afc9-11e6-986e-c4b301cdf627,at.tomtasche.reader,It reads odt documents ...and that's all I needed.,December 08 2014,5
133670,153851,7c5a8266-afc9-11e6-91cd-c4b301cdf627,at.tomtasche.reader,Works Opens odt files well,December 08 2014,5
133671,153852,7c5a82e8-afc9-11e6-9390-c4b301cdf627,at.tomtasche.reader,My phone is like that PC because of Apps Not Necessary to Getting printout using mob so well,December 07 2014,4
133672,153854,7c5a83ee-afc9-11e6-a4df-c4b301cdf627,at.tomtasche.reader,Reads documents at least It open my documents but when it comes to editing them I try to save and it reverts back to the original document so editing it is pointless.,December 06 2014,3
133673,153856,7c5a84e8-afc9-11e6-a8ee-c4b301cdf627,at.tomtasche.reader,Works great Does what its made for love it,December 04 2014,5
133674,153857,7c5a8568-afc9-11e6-926a-c4b301cdf627,at.tomtasche.reader,Solid Needs to open docs from sd card for 5 star rating.,December 04 2014,4
133675,153858,7c5a85e3-afc9-11e6-ab34-c4b301cdf627,at.tomtasche.reader,Oks juga ..,December 04 2014,4
133676,153859,7c5a8663-afc9-11e6-8a34-c4b301cdf627,at.tomtasche.reader,Cool This app doing its job really well. Open document files looks really good,December 03 2014,4
133677,153861,7c5a875e-afc9-11e6-b512-c4b301cdf627,at.tomtasche.reader,Edit mode error Edit mode does not save what I edit. In addition it makes its own editing on the file. Please fix.,November 30 2014,3
133678,153862,7c5a87d4-afc9-11e6-9360-c4b301cdf627,at.tomtasche.reader,rubbish takes ages to even open a simple spreadsheet. total rubbish,November 29 2014,1
133679,153864,7c5a88cf-afc9-11e6-af77-c4b301cdf627,at.tomtasche.reader,Studio Plate Odlična  veoma malo koristi ram memorije.,November 28 2014,5
133680,153865,7c5a8e8f-afc9-11e6-b583-c4b301cdf627,at.tomtasche.reader,Clean  clear and easy to navigate my files. Google quality comes through again.,November 27 2014,5
133681,153866,7c5a8f38-afc9-11e6-851f-c4b301cdf627,at.tomtasche.reader,Awesome Opens .odt files without problem :),November 27 2014,5
133682,153867,7c5a8fc5-afc9-11e6-8fca-c4b301cdf627,at.tomtasche.reader,Just the ticket for me.,November 26 2014,5
133683,153868,7c5a903a-afc9-11e6-867e-c4b301cdf627,at.tomtasche.reader,Still a bit buggy Format corruption on some files,November 26 2014,3
133684,153869,7c5a90bd-afc9-11e6-9fe4-c4b301cdf627,at.tomtasche.reader,It works well for odt filevI wanted to view.,November 24 2014,5
133685,153870,7c5a9140-afc9-11e6-b65f-c4b301cdf627,at.tomtasche.reader,Can't convert to any other formats! It seems to be working fine and open odt file and other formats  can edit copy and paste- but the major point that it couldn't show anything else in future tools. Probably not bad.,November 23 2014,4
133686,153871,7c5a91b8-afc9-11e6-892a-c4b301cdf627,at.tomtasche.reader,Good app It does what it says and works well. Quite basic user interface though.,November 23 2014,4
133687,153872,7c5a923a-afc9-11e6-bfe5-c4b301cdf627,at.tomtasche.reader,monica Excellent app - does exactly what i need it to do - opens libre office on my phone & tablet!,November 23 2014,5
133688,153874,7c5a9333-afc9-11e6-9994-c4b301cdf627,at.tomtasche.reader,Freeware advertised Small annoying FLASHING advert bar to monetize. No edit function.,November 21 2014,3
133689,153875,7c5a93b8-afc9-11e6-b88c-c4b301cdf627,at.tomtasche.reader,Open Document- Does a GREAT Job! Thursday  11/20/14 9 am PST. The Google Play Application- Open Document has consistently & reliably opened all document format on my smartphone. Download it  try it  and use it. I bet  you will be glad you did!,November 20 2014,5
133690,153876,7c5a9438-afc9-11e6-8275-c4b301cdf627,at.tomtasche.reader,I'm very happy with this app. The edit doesn't work that well. I would have rated five stars if this wasn't an issue. Thanks,November 20 2014,4
133691,153877,7c5a94c5-afc9-11e6-9338-c4b301cdf627,at.tomtasche.reader,AWFUL! The program said that it saved all of my changes  but when I re-opened it  ALL OF MY WORK WAS GONE!!!,November 19 2014,1
133692,153879,7c5a95c7-afc9-11e6-87c6-c4b301cdf627,at.tomtasche.reader,Glitchy today For some reason  it will not save my changes and reverts to the previous version every time I try to save my document. This is extremely frustrating! On second thought  I hate this app! I'm trying to edit my resume so I can apply for work and this stupid app will NOT let me save my changes. I've uninstalled and reinstalled it  to no avail!,November 19 2014,1
133693,153880,7c5a964a-afc9-11e6-a6f8-c4b301cdf627,at.tomtasche.reader,Just for viewing documents This app does exactly what it says.,November 18 2014,4
133694,153881,7c5a96cc-afc9-11e6-bb08-c4b301cdf627,at.tomtasche.reader,Nice! I couldn't imagine editing a document on my phone but it's nice to know that I can.,November 17 2014,4
133695,153883,7c5a97cf-afc9-11e6-a435-c4b301cdf627,at.tomtasche.reader,Works with odt as I hoped. Ads are not too bad.,November 16 2014,4
133696,153884,7c5a9851-afc9-11e6-aade-c4b301cdf627,at.tomtasche.reader,Logical Very much to the point  love the layout  thank you.,November 15 2014,5
133697,153885,7c5a98d4-afc9-11e6-a44e-c4b301cdf627,at.tomtasche.reader,Good with more work A great app. Opens well but does not save properly yet. It needs to save the new file in the same directory as the original with a date stamp. Good lite app but needs a little more work. Ran on Asus Transformer TF300T,November 14 2014,3
133698,153886,7c5a9957-afc9-11e6-9f86-c4b301cdf627,at.tomtasche.reader,Ok Juzt Fine,November 12 2014,3
133699,153887,7c5a99cf-afc9-11e6-bb8c-c4b301cdf627,at.tomtasche.reader,Yes to go Wanna save? Guys you ganna need this...,November 08 2014,4
133700,153888,7c5a9a4f-afc9-11e6-aa07-c4b301cdf627,at.tomtasche.reader,Great app makes us a little less reliant on others Seems great for reading and basic editing. The only problem I have come across is that my back space doesn't work... So I can't correct typos.,November 07 2014,5
133701,153889,7c5a9b21-afc9-11e6-87ea-c4b301cdf627,at.tomtasche.reader,At last got it! Now possible to open *.ods files .,November 07 2014,5
133702,153890,7c5a9bb8-afc9-11e6-bc12-c4b301cdf627,at.tomtasche.reader,Nice Totaly nice,November 07 2014,5
133703,153891,7c5a9c3a-afc9-11e6-90cc-c4b301cdf627,at.tomtasche.reader,Great app You can open and edit OpenOffice docs. What else do ya want?,November 06 2014,5
133704,153892,7c5a9cb0-afc9-11e6-b4ca-c4b301cdf627,at.tomtasche.reader,No problems at all,November 06 2014,4
133705,153893,7c5a9d35-afc9-11e6-ae57-c4b301cdf627,at.tomtasche.reader,grear app Great..,November 05 2014,5
133706,153894,7c5a9db5-afc9-11e6-a356-c4b301cdf627,at.tomtasche.reader,No remove adds option Ill give u 5 stars but the remove add option  which is paid  is not working. I hate adds. But glad this supports ODT files,November 03 2014,3
133707,153895,7c5a9e6b-afc9-11e6-a15c-c4b301cdf627,at.tomtasche.reader,Cannot save odt. It's a great thing to open and edit my .odt files  but the save functionality does not work. The document goes back to it's original form whenever the save button is pressed.,October 30 2014,2
133708,153896,7c5a9ef5-afc9-11e6-8e5f-c4b301cdf627,at.tomtasche.reader,It is working Super,October 27 2014,5
133709,153898,7c5a9fee-afc9-11e6-b934-c4b301cdf627,at.tomtasche.reader,Good App Good but slow,October 25 2014,4
133710,153899,7c5aa073-afc9-11e6-8b34-c4b301cdf627,at.tomtasche.reader,Awesome Nice on to use,October 25 2014,4
133711,153900,7c5aa0f3-afc9-11e6-b6c1-c4b301cdf627,at.tomtasche.reader,Was OK Haven't used this for a while due to dates in calc not displaying correctly and limitations to document size. Edit was a bit of a disaster as it reformatted my document. Have tried again but am now going to uninstall. Not sure if the problem is with newer Libre Office or this app.,October 24 2014,3
133712,153901,7c5aa175-afc9-11e6-b5f2-c4b301cdf627,at.tomtasche.reader,Works... with issues It opens .odt files  which I needed  but it argues every time about where and how to save them  and instead of allowing me to choose any options when saving changes to the open file  it just creates a new file  saves on the internal sd instead of the external  and always names it modified-by-my-half-assed-product or something similiar. I am uninstalling. This program is too annoying with its lack of user-oriented choices,October 23 2014,2
133713,153902,7c5aa1f5-afc9-11e6-a022-c4b301cdf627,at.tomtasche.reader,No support for hyper links in a document. Have been using OpenDocument Reader on my Samsung Tab 3 Lite for several months. It did the trick for reading documents that I have created and posted in Dropbox for all platforms. However  recently I created (with Open Office) and posted a document containing hyper link buttons. The document works fine on a laptop opened with Open Office (waiting for feedback from users using other platforms) but ODR apparently does not provide support to hyper link.,October 23 2014,4
133714,153903,7c5aa27a-afc9-11e6-9ca5-c4b301cdf627,at.tomtasche.reader,Reader works  but editing changes cause saved document errors It works as a reader but edited files are not saved accurately. Hence not useable for editing documents on my tablet.,October 23 2014,3
133715,153904,7c5aa2fd-afc9-11e6-a4b1-c4b301cdf627,at.tomtasche.reader,Nice one Still iam not using but its ok,October 21 2014,3
133716,153906,7c5aa400-afc9-11e6-8ae0-c4b301cdf627,at.tomtasche.reader,SD Card? Needs to open files from SD Card!!!!,October 20 2014,3
133717,153907,7c5aa482-afc9-11e6-a624-c4b301cdf627,at.tomtasche.reader,Great job Very usefull,October 19 2014,5
133718,153908,7c5aa4f8-afc9-11e6-b51d-c4b301cdf627,at.tomtasche.reader,Awesome Works flawlessly!,October 19 2014,5
133719,153911,7c5aa675-afc9-11e6-ae49-c4b301cdf627,at.tomtasche.reader,I've being struggling to get doc's To open in k-9 mail. This one did the trick! Thank you!,October 15 2014,5
133720,153912,7c5aa747-afc9-11e6-bab8-c4b301cdf627,at.tomtasche.reader,Great easy to use. Great job,October 14 2014,5
133721,153913,7c5aa7d4-afc9-11e6-9510-c4b301cdf627,at.tomtasche.reader,Didn't Work For Me Tried to open a spreadsheet in my Google Drive  but although it loaded quickly from 0% to 54% it took several minutes to finish. Tried to edit that same document but the app froze at 82%. Tried several times with the same result. Guess I'll have to wait until LibreOffice is available for Android.,October 14 2014,1
133722,153915,7c5aa8d9-afc9-11e6-9314-c4b301cdf627,at.tomtasche.reader,Open Office user Great that people support open source products. Thanks. Really helpfull.,October 12 2014,4
133723,153916,7c5aa959-afc9-11e6-a2a6-c4b301cdf627,at.tomtasche.reader,Great! I mostly use this to view odt files and it works wonderfully for that. have no idea how well it works for other formats. Works fine from SD card for me,October 12 2014,4
133724,153917,7c5aa9dc-afc9-11e6-be27-c4b301cdf627,at.tomtasche.reader,Very useful I have odt documents on gdrive  and this is the way to review them. I haven't found the editing feature to be very helpful.,October 11 2014,4
133725,153918,7c5aaa5e-afc9-11e6-bc39-c4b301cdf627,at.tomtasche.reader,Is like word... But free Works fine for me,October 10 2014,5
133726,153919,7c5aaae1-afc9-11e6-818c-c4b301cdf627,at.tomtasche.reader,Great job. Exactly what I need - view my Libreoffice docs and make some simple changes easily. Glad you're working on improving it  but I am content right now. Thanks!,October 08 2014,5
133727,153920,7c5aab61-afc9-11e6-8034-c4b301cdf627,at.tomtasche.reader,Ugly ads,October 08 2014,1
133728,153921,7c5aabe3-afc9-11e6-9e4e-c4b301cdf627,at.tomtasche.reader,Grateful for this useful app So glad that someone has recognised that Open Office is used by so many people. Thanks for a great app.,October 07 2014,5
133729,153922,7c5aac5c-afc9-11e6-ab01-c4b301cdf627,at.tomtasche.reader,gina Good  I like it,October 07 2014,5
133730,153923,7c5aacde-afc9-11e6-a964-c4b301cdf627,at.tomtasche.reader,Pablo Amazing,October 05 2014,5
133731,153924,7c5aad5e-afc9-11e6-8ae7-c4b301cdf627,at.tomtasche.reader,Cannot open files from sd card This app does it's job pretty well. The only disapointment is that it cannot open files that are stored in the sd card. You have to copy them to the device storage.,October 04 2014,3
133732,153925,7c5aadd9-afc9-11e6-8d82-c4b301cdf627,at.tomtasche.reader,Excellent Makes using Google drive to sync my documents to my phone a snap.,October 03 2014,5
133733,153926,7c5aae59-afc9-11e6-b84e-c4b301cdf627,at.tomtasche.reader,El documento se cierra constantemente,October 01 2014,3
133734,153927,7c5aaedc-afc9-11e6-9b02-c4b301cdf627,at.tomtasche.reader,It does exactly what I need it to  pure and simple.,September 30 2014,5
133735,153928,7c5aaf5e-afc9-11e6-a4e3-c4b301cdf627,at.tomtasche.reader,Very good and useful app! I will recommend this app to everybody who is using OpenOffice on the PC  it helps to open all files which I keep on SkyDrive and in Dropbox and need to use on my Android devices. It is excellent -thanks!,September 30 2014,5
133736,153929,7c5aafd4-afc9-11e6-98a4-c4b301cdf627,at.tomtasche.reader,Awesome I need read access to various docs and this app does everything I need with regards to reading those docs!,September 30 2014,5
133737,153930,7c5ab057-afc9-11e6-b572-c4b301cdf627,at.tomtasche.reader,good app best developers,September 30 2014,5
133738,153931,7c5ab0d9-afc9-11e6-9d3f-c4b301cdf627,at.tomtasche.reader,best of the open document apps! Until LibreOffice of Android becomes available (if ever)  this is the best app for accessing and modifying odf/ods files. It handles password protected documents without a hitch and flawlessly integrated with the Hammerhilll printer app for printing documents to my WiFi printer. As new features get added to this there is no reason for OpenOffice or LibreOffice for Android. Nice work!,September 29 2014,5
133739,153932,7c5ab166-afc9-11e6-a971-c4b301cdf627,at.tomtasche.reader,ODS file issues My open calc file has three columns. The second columns can span several lines. I find out if reading on android device the second column will stretch out in one single line and overlap the third column so I cannot really make out the two columns at all. In my original document there is no carriage return for the data in the second column but I still think the viewer itself should be intelligent enough to recognize the column width to break things into as many lines as required so it won't overflow into neighbouring columns,September 28 2014,4
133740,153933,7c5ab22e-afc9-11e6-b9eb-c4b301cdf627,at.tomtasche.reader,Simple and always do the work it supposed to do,September 27 2014,5
133741,153934,7c5ab2c5-afc9-11e6-8fb4-c4b301cdf627,at.tomtasche.reader,Works Wanted to view .odt on G S2 and it does that very well thanks,September 27 2014,5
133742,153935,7c5ab347-afc9-11e6-9807-c4b301cdf627,at.tomtasche.reader,works really well i just need to be able to open my documents and I never had trouble with it. thank you!,September 26 2014,5
133743,153937,7c5ab440-afc9-11e6-b4f4-c4b301cdf627,at.tomtasche.reader,It's Ok could be better. I Was able to open the document format that was giving me trouble but I have a hard time editing the changes don't stick. Then locating the document with the changes is impossible.,September 25 2014,3
133744,153938,7c5ab4c2-afc9-11e6-90b3-c4b301cdf627,at.tomtasche.reader,Great Only need for viewing purposes. It does this very well. I'm an actor and can review scripts on the go.,September 25 2014,4
133745,153939,7c5ab542-afc9-11e6-b5fa-c4b301cdf627,at.tomtasche.reader,Couldn't get it to save an edit. Might have done it wrong. Works great if you just want to view Microsoft Word documents on an android system.,September 25 2014,4
133746,153940,7c5ab5c5-afc9-11e6-b750-c4b301cdf627,at.tomtasche.reader,Its alright. It works but the ads are obnoxiously big. Also  $7 USD to remove ads on something that barely amounts to a document viewer is rather exorbitant. Note: this is open-source  but it is NOT free software according to the FSF. Important distinction for those who care.,September 25 2014,3
133747,153941,7c5ab647-afc9-11e6-a08b-c4b301cdf627,at.tomtasche.reader,Does a good job Easy to use  does what is needed.,September 24 2014,5
133748,153942,7c5ab6d4-afc9-11e6-918e-c4b301cdf627,at.tomtasche.reader,I use it for accessing files from pc to smart phone.,September 24 2014,5
133749,153943,7c5ab761-afc9-11e6-824c-c4b301cdf627,at.tomtasche.reader,Super. Oh no......,September 24 2014,5
133750,153944,7c5ab7d7-afc9-11e6-a8ef-c4b301cdf627,at.tomtasche.reader,Great program!,September 23 2014,4
133751,153945,7c5ab859-afc9-11e6-9881-c4b301cdf627,at.tomtasche.reader,Great tool Fast and easy to use.,September 23 2014,5
133752,153946,7c5ab8dc-afc9-11e6-b146-c4b301cdf627,at.tomtasche.reader,Does teh job :D,September 22 2014,5
133753,153947,7c5ab954-afc9-11e6-b70b-c4b301cdf627,at.tomtasche.reader,Didn't save the changes,September 22 2014,1
133754,153948,7c5ab9d4-afc9-11e6-8ad6-c4b301cdf627,at.tomtasche.reader,Editing does not work The editor looks like it's working  but as soon as I press the save button the edits all disappear. Still  I appreciate the effort these developers are putting into supporting ODF on Android.,September 20 2014,4
133755,153950,7c5abacf-afc9-11e6-88d8-c4b301cdf627,at.tomtasche.reader,It's fantastic  couldn't manage without it :-),September 17 2014,5
133756,153951,7c5abb51-afc9-11e6-b13d-c4b301cdf627,at.tomtasche.reader,Won't even download,September 17 2014,1
133757,153952,7c5abbca-afc9-11e6-998f-c4b301cdf627,at.tomtasche.reader,Reliable and fast,September 16 2014,5
133758,153954,7c5abccf-afc9-11e6-95dc-c4b301cdf627,at.tomtasche.reader,Delivers what I need Excellent,September 15 2014,5
133759,153955,7c5abd45-afc9-11e6-88ca-c4b301cdf627,at.tomtasche.reader,Open Document Reader It is much easier to use than any other document reader and it's free,September 14 2014,5
133760,153956,7c5abdd1-afc9-11e6-a8e0-c4b301cdf627,at.tomtasche.reader,To read is fine Its really helpful,September 14 2014,4
133761,153957,7c5abe54-afc9-11e6-b1f0-c4b301cdf627,at.tomtasche.reader,Great app Very useful document viewer and editor.,September 13 2014,5
133762,153958,7c5abed7-afc9-11e6-ad4b-c4b301cdf627,at.tomtasche.reader,It does what it says it does I could have sworn I was able to edit before as I don't remember downloading any other OpenOffice app. but they say it was never available... so. It's an alright app. it does exactly what it says it does and not much more. EDIT: Yay! An edit fearure!,September 13 2014,4
133763,153959,7c5abf94-afc9-11e6-994a-c4b301cdf627,at.tomtasche.reader,I can read I was lightly badgered into writing this.,September 12 2014,4
133764,153960,7c5ac02b-afc9-11e6-95cb-c4b301cdf627,at.tomtasche.reader,Absolute rubbish Downloaded to make some edits to a document  saved after I was done and emailed it to myself only to find it didn't save and emailed me the unedited version. Will be avoiding this app.,September 12 2014,1
133765,153961,7c5ac0ab-afc9-11e6-a231-c4b301cdf627,at.tomtasche.reader,Great Edit and view odt docs from dropbox,September 11 2014,5
133766,153962,7c5ac126-afc9-11e6-989a-c4b301cdf627,at.tomtasche.reader,Read? Read!! Work.,September 11 2014,5
133767,153963,7c5ac1a6-afc9-11e6-b5f7-c4b301cdf627,at.tomtasche.reader,Read  Edit are just fine. I need to add entries in an existing calc sheet and it won't permit. Also does not have calc capability. Not installing  yet  but it does not solve my problem.,September 11 2014,3
133768,153964,7c5ac228-afc9-11e6-b65e-c4b301cdf627,at.tomtasche.reader,Perfect Seemless. Great interface.,September 10 2014,5
133769,153969,7c5ac4cf-afc9-11e6-b593-c4b301cdf627,at.tomtasche.reader,Doesnt open .ods files Cant do anything with open format files  broken and does not work. Galaxy s5,September 03 2014,1
133770,153970,7c5ac551-afc9-11e6-abff-c4b301cdf627,at.tomtasche.reader,Goods app. Use it often.,September 02 2014,5
133771,153971,7c5ac5d4-afc9-11e6-ae8f-c4b301cdf627,at.tomtasche.reader,Worked great just what i needed,September 01 2014,5
133772,153972,7c5ac654-afc9-11e6-8961-c4b301cdf627,at.tomtasche.reader,Okay but crashes. Read  edit  create and crash. I'll keep it up in the background to use as I get time but it continually crashes  forcing me to reload the document and search for where I left off. This never happens on my laptop so why does it happen on my phone? It's a good app but if I find one better ...,August 31 2014,3
133773,153973,7c5ac6d7-afc9-11e6-992a-c4b301cdf627,at.tomtasche.reader,wont' see odf files on external storage.,August 31 2014,1
133774,153974,7c5ac74f-afc9-11e6-8076-c4b301cdf627,at.tomtasche.reader,Open Document reader Quickly opens any document format I have used,August 31 2014,5
133775,153975,7c5ac7d1-afc9-11e6-8c9d-c4b301cdf627,at.tomtasche.reader,Its good Easy to navigate!!!,August 30 2014,5
133776,153976,7c5ac854-afc9-11e6-b4e7-c4b301cdf627,at.tomtasche.reader,No equation support I need it to open the equations I type out.,August 29 2014,2
133777,153977,7c5ac8cc-afc9-11e6-acf0-c4b301cdf627,at.tomtasche.reader,I like it. Dear Developer(s)  it's great to see this. Great job so far  but you're not done yet. When editing is smoothed out you'll get 5 stars from me. Keep up the good work.,August 29 2014,3
133778,153978,7c5ac94c-afc9-11e6-994f-c4b301cdf627,at.tomtasche.reader,Excellent Does exactly what it says on the tin,August 29 2014,5
133779,153979,7c5ac9d1-afc9-11e6-a6db-c4b301cdf627,at.tomtasche.reader,It almost works Barely supports any common formats,August 28 2014,3
133780,153980,7c5aca47-afc9-11e6-9004-c4b301cdf627,at.tomtasche.reader,simple and reliable,August 26 2014,4
133781,153981,7c5acac7-afc9-11e6-874f-c4b301cdf627,at.tomtasche.reader,Works great! No complaints - makes life easier  I can view spreadsheets!,August 26 2014,5
133782,153982,7c5acb4c-afc9-11e6-a3e5-c4b301cdf627,at.tomtasche.reader,A Big Help Reliably does what it says it will.,August 26 2014,5
133783,153983,7c5acbc2-afc9-11e6-964e-c4b301cdf627,at.tomtasche.reader,Editing cells is an issue. My issue with this is that I cannot edit an empty cell. Otherwise it's a wonderful app for viewing files.,August 26 2014,3
133784,153984,7c5acc45-afc9-11e6-acdc-c4b301cdf627,at.tomtasche.reader,It works  but comments are just dumped on the screen The whole point of comments in a spreadsheet is to hide lots of detailed information or a long description of a cell inside the comment. This app just dumps the comments on the screen. It would be better if the cells woth comments have a red dot and a click shows the comment full screen or something. Useful app. Thanks for making it.,August 26 2014,4
133785,153985,7c5acd0f-afc9-11e6-a4c2-c4b301cdf627,at.tomtasche.reader,Should state in description that you can't create documents would have saved me wasting my time downloading it.,August 25 2014,1
133786,153986,7c5acda3-afc9-11e6-a398-c4b301cdf627,at.tomtasche.reader,This app has made it easier to read any file transfered from my laptop in order to do school work on the go,August 24 2014,5
133787,153987,7c5ace26-afc9-11e6-b6ac-c4b301cdf627,at.tomtasche.reader,Good app App works for me.,August 23 2014,4
133788,153988,7c5ace9e-afc9-11e6-82ac-c4b301cdf627,at.tomtasche.reader,Does not save edits,August 23 2014,1
133789,153989,7c5acf1e-afc9-11e6-87b5-c4b301cdf627,at.tomtasche.reader,Great It opened perfectly,August 22 2014,5
133790,153991,7c5ad023-afc9-11e6-a47c-c4b301cdf627,at.tomtasche.reader,Does what it says Plain and simple,August 21 2014,5
133791,153992,7c5ad09c-afc9-11e6-943c-c4b301cdf627,at.tomtasche.reader,Too cheap to buy office,August 21 2014,5
133792,153993,7c5ad11e-afc9-11e6-9291-c4b301cdf627,at.tomtasche.reader,Perfect love it,August 20 2014,5
133793,153994,7c5ad194-afc9-11e6-9a44-c4b301cdf627,at.tomtasche.reader,Does what I need And quickly  too!,August 19 2014,5
